{
  "schema": "keyval.coverage/v1",
  "build_id": "fixture-build",
  "runs": 8,
  "cells": {
    "fault": {
      "crash_restart": 12,
      "all_node_crash": 0,
      "permanent_loss": 2,
      "symmetric_partition": 9,
      "asymmetric_partition": 0,
      "message_loss": 7,
      "message_delay": 0,
      "message_duplication": 0,
      "stall": 4
    },
    "fault_pair": {
      "crash_restart+all_node_crash": 0,
      "crash_restart+permanent_loss": 0,
      "crash_restart+symmetric_partition": 3,
      "crash_restart+asymmetric_partition": 0,
      "crash_restart+message_loss": 0,
      "crash_restart+message_delay": 0,
      "crash_restart+message_duplication": 0,
      "crash_restart+stall": 1,
      "all_node_crash+permanent_loss": 0,
      "all_node_crash+symmetric_partition": 0,
      "all_node_crash+asymmetric_partition": 0,
      "all_node_crash+message_loss": 0,
      "all_node_crash+message_delay": 0,
      "all_node_crash+message_duplication": 0,
      "all_node_crash+stall": 0,
      "permanent_loss+symmetric_partition": 0,
      "permanent_loss+asymmetric_partition": 0,
      "permanent_loss+message_loss": 0,
      "permanent_loss+message_delay": 0,
      "permanent_loss+message_duplication": 0,
      "permanent_loss+stall": 0,
      "symmetric_partition+asymmetric_partition": 0,
      "symmetric_partition+message_loss": 0,
      "symmetric_partition+message_delay": 0,
      "symmetric_partition+message_duplication": 0,
      "symmetric_partition+stall": 0,
      "asymmetric_partition+message_loss": 0,
      "asymmetric_partition+message_delay": 0,
      "asymmetric_partition+message_duplication": 0,
      "asymmetric_partition+stall": 0,
      "message_loss+message_delay": 0,
      "message_loss+message_duplication": 0,
      "message_loss+stall": 0,
      "message_delay+message_duplication": 0,
      "message_delay+stall": 0,
      "message_duplication+stall": 0,
      "symmetric_partition+message_loss": 2
    },
    "topology": {
      "3/2": 5,
      "4/1": 3,
      "2/2/1": 1,
      "asymmetric_cycle": 0,
      "other_partition": 0
    },
    "crash_point": {
      "idle": 4,
      "before_write": 0,
      "mid_append": 3,
      "after_write_before_sync": 5,
      "after_sync_before_completion": 0,
      "after_commit_before_reply": 0,
      "after_truncate_before_sync": 0,
      "after_create_before_dir_sync": 0
    },
    "outcome": {
      "success": 210,
      "mismatch": 14,
      "conflict": 0,
      "live_capacity": 0,
      "history_full": 0,
      "unknown": 6,
      "not_leader": 31,
      "busy": 0,
      "unavailable": 9,
      "recovering": 0
    },
    "operation": {
      "put": 120,
      "delete": 0,
      "cas": 44,
      "get": 98,
      "scan": 0,
      "status": 7
    }
  }
}
